{
  "emailAddress": "occaecat incididunt",
  "contactPointType": [
    {
      "id": null,
      "name": "dolor fugiat do"
    }
  ],
  "id": "sed nisi",
  "activeFromDate": "1951-07-03",
  "bestTimeToContactEndTime": "00:00:01",
  "emailLatestBounceReasonText": "veniam incididunt labore in",
  "emailLatestBounceDateTime": null,
  "activeToDate": "1993-05-12",
  "emailDomain": "nisi",
  "auditInfo": {
    "isDeleted": false,
    "createdBy": "voluptate",
    "updatedBy": "adipisicing nulla qui",
    "updatedDate": null,
    "createdDate": "1950-04-02T11:20:28.713Z"
  },
  "profileFirstCreatedDate": null,
  "profileOccurrenceCount": null,
  "party": [
    "aliquip sunt exercitation"
  ],
  "name": "commodo ad quis eiusmod aliqua",
  "bestTimeToContactStartTime": "00:00:01",
  "partyRole": [
    "mollit quis ea in"
  ],
  "forBusinessUse": null,
  "emailMailBox": "est Excepteur",
  "primaryFlag": false,
  "forPersonalUse": null,
  "profileLastUpdatedDate": null
}
